{
  "id": "material_metal_copper",
  "type": "material",
  "category": "metal",
  "subcategory": "pure",
  "name": "Copper",
  "description": "Pipes, roofing (premium), wire, small mechanisms Excellent conductor, antimicrobial",
  "properties": {
    "durability": "high",
    "cost": "moderate",
    "appearance": "Orange-red when new, brown to green when aged",
    "workability": "moderate"
  },
  "tags": [
    "construction",
    "metal",
    "whisker-punk"
  ],
  "status": "in-progress",
  "completionPercentage": 60,
  "lastModified": "2025-10-06T22:44:43.072Z",
  "contributors": [
    "migration-script"
  ],
  "notes": "Migrated from original markdown documentation. Needs manual review and enhancement."
}