{
  "id": "material_metal_bronze",
  "type": "material",
  "category": "metal",
  "subcategory": "alloy",
  "name": "Bronze",
  "description": "Bells, statues, larger gears, structural elements Very durable, beautiful aging",
  "properties": {
    "durability": "high",
    "cost": "moderate",
    "appearance": "Reddish-gold when new, green patina when aged",
    "workability": "moderate"
  },
  "tags": [
    "construction",
    "metal",
    "whisker-punk"
  ],
  "status": "in-progress",
  "completionPercentage": 60,
  "lastModified": "2025-10-06T22:44:43.072Z",
  "contributors": [
    "migration-script"
  ],
  "notes": "Migrated from original markdown documentation. Needs manual review and enhancement."
}