{
  "id": "material_metal_brass",
  "type": "material",
  "category": "metal",
  "subcategory": "alloy",
  "name": "Brass",
  "description": "Gears, decorative elements, fittings Corrosion-resistant, pleasant appearance",
  "properties": {
    "durability": "high",
    "cost": "moderate",
    "appearance": "Bright gold when polished, browns when aged",
    "workability": "moderate"
  },
  "tags": [
    "construction",
    "metal",
    "whisker-punk"
  ],
  "status": "in-progress",
  "completionPercentage": 60,
  "lastModified": "2025-10-06T22:44:43.071Z",
  "contributors": [
    "migration-script"
  ],
  "notes": "Migrated from original markdown documentation. Needs manual review and enhancement."
}